<?xml version="1.0" encoding="UTF-8"?>
<!--
  ~ /*
  ~ *  Copyright (c) 2017, WSO2 Inc. (http://www.wso2.org) All Rights Reserved.
  ~ *
  ~ *  WSO2 Inc. licenses this file to you under the Apache License,
  ~ *  Version 2.0 (the "License"); you may not use this file except
  ~ *  in compliance with the License.
  ~ *  You may obtain a copy of the License at
  ~ *
  ~ *    http://www.apache.org/licenses/LICENSE-2.0
  ~ *
  ~ * Unless required by applicable law or agreed to in writing,
  ~ * software distributed under the License is distributed on an
  ~ * "AS IS" BASIS, WITHOUT WARRANTIES OR CONDITIONS OF ANY
  ~ * KIND, either express or implied.  See the License for the
  ~ * specific language governing permissions and limitations
  ~ * under the License.
  ~ */
  -->

<xs:schema xmlns:xs="http://www.w3.org/2001/XMLSchema">
    <!-- Simple elements-->
    <xs:element name="title" type="xs:string"/>
    <xs:element name="author" type="xs:string"/>
    <xs:element name="price" type="xs:string"/>

    <!-- Attributes -->
    <xs:attribute name="id" type="xs:string"/>

    <!-- Complex elements -->
    <xs:element name="catalog">
        <xs:complexType>
            <xs:sequence>
                <xs:element name="book" maxOccurs="unbounded">
                    <xs:complexType>
                        <xs:sequence>
                            <xs:element ref="title"/>
                            <xs:element ref="author"/>
                            <xs:element ref="price"/>
                        </xs:sequence>
                        <xs:attribute ref="id" use="required"/>
                    </xs:complexType>
                </xs:element>
            </xs:sequence>
        </xs:complexType>
    </xs:element>
</xs:schema>